Yg76,2,"Shares of Receptos (NASDAQ: RCPT) spiked higher Tuesday, on a report from Proactiv Investors that Receptos rejected a $200 bid from AstraZeneca (NYSE: AZN), while Teva Pharmaceutical Industries (NASDAQ: TEVA) and Gilead Sciences (NASDAQ: GILD) reportedly offered $280. The article states Receptos is willing to accept an offer of $350 per share.Spokepersons for Receptos, AstraZeneca and Proactive Investors did not return calls.Receptos shares 2.5% Tuesday, closing at $160.44.China Mobile Games to be Purchased by Pegasus Investment for $22.00/ADS",6/9/2015 19:18:00,"Benzinga's M&A Chatter for Tuesday June 9, 2015",The Rumor:,RCPT,,AZN,,,,,,,
Yg76,3,"China Mobile Games and Entertainment Group Limited (NYSE: CMGE)announced Tuesday, that it has entered into a definitive agreement and plan of merger with Pegasus Investment Holdings Limited and Pegasus Merger Sub Limited, under which Pegasus will acquire CMGE for $22.00 per ADS.China Mobile Games Board unanimously approved the merger agreement. China Mobile Games shares gained more than 5% Tuesday, closing at $21.09.Hearing Unconfirmed Market Chatter of Potential Unilever Bid for Colgate-Palmolive",6/9/2015 19:18:00,"Benzinga's M&A Chatter for Tuesday June 9, 2015",The Deal:,CMGE,,,,,,,,,
Yg76,4,"Shares of Colgate-Palmolive Co. (NYSE: CL) Tuesday, on unconfirmed market chatter that Unilever plc (NYSE: UL) is preparing a bid for the maker of Colgate Toothpaste and Palmolive dish soap. The premium would reportedly more than 20%, according to a source.Spokespersons for Colgate-Palmolive and Unilever did not respond to requests for comment.Colgate-Palmolive shares gained 1% Tuesday, closing at $66.03. Diebold in Talks to Acquire Wincor Nixdorf",6/9/2015 19:18:00,"Benzinga's M&A Chatter for Tuesday June 9, 2015",The Rumor:,CL,,UL,,,,,,,
Yg76,5,"Shares of Diebold (NYSE: DBD) spiked higher Tuesday, on a report from Reuters that it is in talks to acquire German rival Wincor Nixdorf (OTC: WNXDY), according to sources. Wincor reportedly has hired Goldman Sachs as an advisor, while Diebold is said to be working with JP Morgan.A Diebold spokesperson declined comment, while a Wincor Nixdorf spokesperson was not available.Diebold shares gained more than 7% Tuesday, closing at $37.83. Posted-In: News Rumors M&A Movers© 2015 Benzinga.com. Benzinga does not provide investment advice. All rights reserved.",6/9/2015 19:18:00,"Benzinga's M&A Chatter for Tuesday June 9, 2015",The Rumor:,WNXDY,,DBD,,,,,,,
fo77,0,"The following are the M&A deals, rumors and chatter circulating on Wall Street for Monday June 8, 2015:Rumor Circulating of Merck Bid for Celgene",6/8/2015 20:17:00,"Benzinga's M&A Chatter for Monday June 8, 2015",NA,,,,,,,,,,
fo77,1,"Shares of Celgene Corporation (NASDAQ: CELG) spiked higher, Monday, on unconfirmed market chatter of a potential bid from Merck & Co (NYSE: MRK). The rumored offer is between $131 and $133, according to sources. Celgene had a market cap of $88 billion, following the rumor, while Merck's cap is about double that.Spokespersons for Celgene and Merck did not respond to requests for comment.Celgene shares gained $0.29 Monday, to close at $$111.01.Cypress Fails to Finalize Merger Agreement with ISSIThe Failed Merger:Integrated Silicon Solution, Inc. (NASDAQ: ISSI) announced Monday, that Cypress Semiconductor (NASDAQ: CY) has failed to finalize a merger agreement by the deadline of June 7, 2015 imposed by Cypress. ISSI says Cypress received the negotiated draft agreement from ISSI on Friday, June 5, 2015. Despite the merger agreement being nearly fully negotiated, ISSI believes a transaction with Cypress presents significant antitrust risks in the U.S. and Germany. Cypress offered to acquire ISSI for $20.25 per share on May 15.Integrated Silicon Solution shares fell $0.38 Monday, closing at $20.35.Jiayuan.com Receives Amended 'Going Private' Proposal of $7.20/ADSThe Going Private Proposal:Jiayuan.com International Ltd. (NASDAQ: DATE) announced Monday, that the special committee of the company's board of directors, has an amended 'going private' proposal from Vast Profit of $7.20 per ADS, which is an increase from their previous offer of $5.37 per ADS.The special committee said it is evaluating this and other proposals it has received, and that no decisions have been made.Jiayuan.com shares lost 5.5% Monday, closing at $7.39Report Atmel Considering Options Including Potential Sale",6/8/2015 20:17:00,"Benzinga's M&A Chatter for Monday June 8, 2015",The Rumor:,CELG,,MRK,,,,,,,
fo77,2,"Shares of Atmel (NASDAQ: ATML) soared late Monday, on a report from Reuters, that the maker of microcontrollers is exploring a potential sale of the company, along with other strategic alternatives, according to sources. Atmel is reportedly working with Qatalyst Partners as an advisor on the possible sale.Spokespersons for Atmel and Qatalyst did not immediately respond to Reuters requests for comment.There was unusual activity reported by Benzinga in the Atmel November $11 call last week. That call trade up 87% immediately following the Reuters report.Atmel shares gained 3.5% Monday, closing at $9.75. Sungy Mobile Enters into Agreement for 'Going Private' Transaction of $4.90/ADSThe Going Private Transaction:Sungy Mobile Limited (NASDAQ: GOMO) announced Monday, that it has entered into an agreement and plan of merger with Sunflower Parent Limited, IDG, CBC Mobile Venture Limited and Sunflower Merger Sub Limited. Under the agreement, at the effective time of the merger, each of the Co's class A ordinary shares and class B ordinary shares issued and outstanding immediately prior to the effective time of the Merger will be cancelled and cease to exist in exchange for the right to receive US$0.81667 in cash without interest, and each American Depositary Share of the Company, which represents six class A ordinary shares, will be cancelled in exchange for the right to receive $4.90 in cash without interestSungy Mobile shares lost more than 3% Monday, closing at $4.61. Syngenta Rejects Latest Monsanto Proposal, Including $2B Reverse Break-up FeeThe Rejection:Syngenta (NYSE: SYT) confirmed Monday, that it received a second letter from Monsanto (NYSE: MON) which essentially repeated their first proposal of April 18 of CHF449 in cash. Monsanto added a $2 billion reverse break-up fee, which Syngenta described at ""wholly inadequate"". Syngenta again rejected the proposal.Syngenta shares lost 1.1.72% Monday, closing at $86.81, while Monsanto gained $0.12, to end the day at $113.92Posted-In: News Rumors Management M&A© 2015 Benzinga.com. Benzinga does not provide investment advice. All rights reserved.",6/8/2015 20:17:00,"Benzinga's M&A Chatter for Monday June 8, 2015",The Rumor:,ATML,,,,,,,,,
Lz59,0,"The following are the M&A deals, rumors and chatter circulating on Wall Street for Friday June 5, through Sunday June 7, 2015:Shire Considers $18.32B Takeover of Actelion",6/7/2015 20:16:00,Benzinga's Weekend M&A Chatter,NA,,,,,,,,,,
Lz59,1,"Shire plc (NASDAQ: SHPG) has approached Swiss drug company Actelion Ltd (OTC: ALIOF) regarding a potential £12 billion buyout, according to sources as reported by the UK's Sunday Times. The contact was made several weeks ago, according to the sources. Shire is said to have discussed an offer of CHF160 per share for Actelion, a premium of 21% over Friday's closing price. Shire declined comment on the report. An Actelion spokesperson was not immediately available for comment.Shire shares lost $0.26 Friday, to close at $251.51.JA Solar Receives 'Going Private' Proposal of $9.69/ADSThe Offer: JA Solar Holdings Co., Ltd. (NASDAQ: JASO) announced Friday, that its Board has received a preliminary ""going private"" proposal from Chairman and CEO Baofang Jin and Jinglong Group Co., Ltd., to acquire all of the outstanding shares of JASO not already owned by the buyer group, for $9.69 per ADS (each ADS represents five ordinary shares) ($1.938 per ordinary share) in cash, subject to conditions.The Board will form a special committee to consider the proposal. JA Solar shares rose more than 12% Friday, closing at $9.07.Cardinal Health to Acquire The Harvard Drug Group for ~$1.115B",6/7/2015 20:16:00,Benzinga's Weekend M&A Chatter,The Rumor:,ALIOF,,SHPG,,,,,,,
Lz59,2,"Cardinal Health, Inc. (NYSE: CAH) announced Friday, plans to acquire The Harvard Drug Group for $1.115 billion using existing cash and new debt. The deal is expected to close in the beginning of FY 2016. Cardinal Health shares gained $0.43 Friday, closing at $88.04. Report Brazilian Billionaire May Bid for Diageo",6/7/2015 20:16:00,Benzinga's Weekend M&A Chatter,The Deal:,,,CAH,,,,,,,
Lz59,3,"Shares of Diageo plc (NYSE: DEO) soared late Friday, on a report from Bloomberg, that Brazilian billionaire Jorge Paulo Lemann is considering a bid for the UK-based liquor manufacturer. Lemann runs 3G Captital, which together with Warren Buffet's Berkshire Hathaway, acquired H.J. Heinz in 2013, and arranged a deal to merge it with Kraft Foods Group, Inc. (NASDAQ: KRFT) this year.Diageo shares gained 8% Friday, closing at $118.00. GE Near Deal to Sell PE Lending Unit to Canada Pension Plan Investment Board",6/7/2015 20:16:00,Benzinga's Weekend M&A Chatter,The Rumor:,DEO,,,,,,,,,
Lz59,4,"General Electric (NYSE: GE) is near a deal to sell its private-equity lending unit to Canada Pension Plan Investment Board, according to the Wall Street Journal. The deal reportedly will include more than $10 billion of assets, but less than $16 billion, according to sources. The report says it is possible the deal could still fall apart.GE shares gained $0.03 Friday, closing at $27.29. Monsanto Adds $2B Reverse Break-up Fee to OfferThe Offer:Monsanto Company (NYSE: MON) on Sunday, reaffirmed its CHF449 cash and stock offer for Syngenta (NYSE: SYT) and added a new $2 billion reverse break-up fee payable by Monsanto if it is unable to obtain necessary global regulatory approvals. Syngenta announced on May 8, it had rejected Monsanto's same CHF449 bid.Syngenta shares lost 1.5% Friday, closing at $88.33, while Monsanto gained $0.22, to end the day at $113.80. Posted-In: News Rumors M&A Movers© 2015 Benzinga.com. Benzinga does not provide investment advice. All rights reserved.",6/7/2015 20:16:00,Benzinga's Weekend M&A Chatter,The Rumor:,,,,,,,,,,
Ua90,0,"The following are the M&A deals, rumors and chatter circulating on Wall Street for Thursday June 4, 2015:Opko Health to Acquire Bio-Reference Laboratories in All-Stock Transaction",6/4/2015 20:32:00,"Benzinga's M&A Chatter for Thursday June 4, 2015",NA,,,,,,,,,,
Ua90,1,"Opko Health, Inc. (NYSE: OPK) and Bio-Reference Laboratories, Inc. (NNASDAQ: BRLI) announced Thursday, that Opko will acquire Bio-Reference Laboratories. Under the terms of the agreement, BRLI common stock will receive 2.75 shares of OPKO common stock for each share of BRLI common stock, valued at $52.58 per share of BRLI common stock. The deal is expected to be completed during H2 of 2015. Bio-Reference Laboratories shares rose 20% Thursday, to close at $39.60, while Opko shares lost 15% to close at $16.47.T-Mobile, Dish Network In Merger Talks",6/4/2015 20:32:00,"Benzinga's M&A Chatter for Thursday June 4, 2015",The Deal:,BRLI,,OPK,,,,,,,
Ua90,2,"Shares of T-Mobile US (NYSE: IBM) traded as high as $43.25 Thursday, while shares of Dish Network (NASDAQ: DISH) traded at $76.50, following a Wall Street Journal report Wednesday, that the two companies were in merger talks, according to sources. Dish CEO Charlie Ergen would reportedly become the chairman of the combined company, with T-Moblie CEO John Legere becoming the CEO of the new entity.According to the sources, the purchase price remains an unresolved issue and could be weeks away. Fox Business' Charlie Gasparino said his sources say the deal could be announced in the next two weeks.T-Mobile shares rose 2.5% Thursday, closing at $39.34, while Dish shares rose almost 5%, closing at $74.25. GigOptix Announces Renewal of Interest in Purchasing GSI Tech at $6.50/ShareThe Offer:GigOptix, Inc. (NYSE MKT: GIG) announced Thursday, that it sent a letter to the board of directors of GSI Technology, Inc. (Nasdaq: GSIT), proposing to acquire all of the outstanding shares of GSI Technology's common stock for $6.50 per share. GigOptix would acquire all of the outstanding shares of GSI Technology common stock for $6.50, consisting of a not yet determined combination of cash, shares of GigOptix and a special cash dividend payable by GSI Technology. GigOptix anticipates the cash consideration can exceed $6.00 per share.GigOptix expects the proposed transaction would be completed by the end of 2015. GSI Technology shares rose almost 3% Thursday, closing at $5.41. GSI Technology shares fell 5.7%, to close at $1.49.Posted-In: News Rumors M&A© 2015 Benzinga.com. Benzinga does not provide investment advice. All rights reserved.",6/4/2015 20:32:00,"Benzinga's M&A Chatter for Thursday June 4, 2015",The Rumor:,,,,,,,,,,
mx39,0,"The following are the M&A deals, rumors and chatter circulating on Wall Street for Wednesday June 3, 2015:Reuters Reports BASF Considering Bid for Syngenta",6/3/2015 19:44:00,"Benzinga's M&A Chatter for Wednesday June 3, 2015",NA,,,,,,,,,,
mx39,1,"Germany's BASF (OTC: BASFY) is looking at a potential bid for Swiss agribusiness company Syngenta AG (NYSE: SYN), according to sources, as reported by Reuters on Wednesday. Syngenta has received a $45 billion takeover offer from Monsanto Co (NYSE: MON), which it rejected.Syngenta has expressed concerns over antitrust issues involving a Monsanto deal. BASF, Syngenta and Monsanto declined to comment to Reuters regarding this new report.Syngenta shares rose $0.06 Wednesday, to close at $26.81.IBM Acquires Blue Box; Terms Not Disclosed",6/3/2015 19:44:00,"Benzinga's M&A Chatter for Wednesday June 3, 2015",The Rumor:,SYN,,BASFY,MON,,,,,,
mx39,2,"IBM (NYSE: IBM) announced Wednesday, it has acquired managed private cloud provider, Blue Box Group. Terms were not disclosed.IBM shares rose $0.27 Wednesday, closing at $169.92. Ctrip Says No Longer Interested in Pursuing Potential M&A Discussion with Qunar Cayman IslandsThe Response:Ctrip.com International, Ltd. (NASDAQ: CTRP) announced Wednesday, that it is no longer interested in pursuing talks for a potential deal with Qunar Cayman Islands Limited (NASDAQ: QUNR), based on Qunar's recent earnings report and corporate actions. Ctrip sent a confidential, non-binding, preliminary proposal to Qunar's board of directors in early May indicating its interest in pursuing a potential deal with Qunar. This week, Qunar responded to Ctrip, stating that the proposal was not accepted and indicating that Qunar would be open to having further discussions.Ctrip shares fell almost 3% Wednesday, closing at $74.88. Qunar shares fell $0.31, to close at $45.71.John Malone Says Lions Gate Could Acquire StarzThe Billionaire Media Mogul Comments:Shares of Entertainment Corp. (NYSE: LGF) and Starz (NASDAQ: STRZA) spiked higher Wednesday, on a report from the Wall Street Journal, that Liberty Media's (NASDAQ: LMCA) John Malone said that Lion's Gate could acquire Starz and possibly other ""free radicals"" in the industry. Malone is a stakeholder in both companies.Lions Gate shares gained almost 2% Wednesday, closing at $33.80. Starz rose 1.5%, closing at $41.70.Posted-In: News Rumors M&A Movers© 2015 Benzinga.com. Benzinga does not provide investment advice. All rights reserved.",6/3/2015 19:44:00,"Benzinga's M&A Chatter for Wednesday June 3, 2015",The Deal:,IBM,,,,,,,,,
HV96,0,"The following are the M&A deals, rumors and chatter circulating on Wall Street for Monday June 1, 2015:Intel to Acquire Altera, $54/Share",6/1/2015 18:45:00,"Benzinga's M&A Chatter for Monday June 1, 2015",NA,,,,,,,,,,
HV96,1,"Intel Corporation (NASDAQ: INTC) and Altera Corporation (NASDAQ: ALTR) announced Monday, an agreement under which Intel would acquire Altera for $54 per share in cash. The transaction is valued at approximately $16.7 billion.The deal is expected to close in six to nine months.Altera shares rose almost 6% Monday, to close at $51.68.Microsoft to Acquire 6Wunderkinder",6/1/2015 18:45:00,"Benzinga's M&A Chatter for Monday June 1, 2015",The Deal:,ALTR,,INTC,,,,,,,
HV96,2,"Microsoft Corp. (NASDAQ: MSFT) has agreed to acquire startup 6Wunderkinder GmbH, creator of the Wunderlist to-do list app, for $1 million to $2 million, according to a source reported by the Wall Street Journal. The app works on Windows, iOS and Android operating systems.Microsoft shares rose $0.37 Monday, closing at $47.23. Gannett Acquires 11 Media Organizations From Digital First Media",6/1/2015 18:45:00,"Benzinga's M&A Chatter for Monday June 1, 2015",The Deal:,,,MSFT,,,,,,,
HV96,3,"Gannett Co., Inc. (NYSE: GCI) announced Monday, that it has completed the acquisition of the remaining 59.36% interest in the Texas-New Mexico Newspapers Partnership that it did not own, from Digital First Media, through the assignment of Gannett's 19.49% interest in the California Newspapers Partnership and additional cash consideration.Gannett now owns 100% of the Texas-New Mexico Newspapers Partnership and no longer has any ownership interest in California Newspapers Partnership.Gannet shares rose $0.48 Monday, closing at $36.27.Posted-In: News Rumors M&A Movers© 2015 Benzinga.com. Benzinga does not provide investment advice. All rights reserved.",6/1/2015 18:45:00,"Benzinga's M&A Chatter for Monday June 1, 2015",The Deal:,GCI,,,,,,,,,
rc79,0,"The following are the M&A deals, rumors and chatter circulating on Wall Street for Friday May 29 through Sunday May 31, 2015:Intel Close to Deal to Acquire Altera for as Much as $54/Share; Deal Could be Announced Monday",5/31/2015 19:37:00,Benzinga's Weekend M&A Chatter,NA,,,,,,,,,,
rc79,1,"The NY Post reported Friday that Intel (NASDAQ: INTC) was close to a deal to acquire Altera Corp (NASDAQ: ALTR) for as much as $54 per share, according to sources. The deal could be announced by the end of this week, the report said. On Sunday, the Wall Street Journal reported the deal could be announced on Monday.The Wall Street Journal first reported on March 27 that the two companies were in talks.Altera shares rose 4% Friday, to close at $48.85.Rosetta Stone Confirms Expression of Interest from RDG Capital Fund ManagementThe Interest:Rosetta Stone Inc. (NYSE: RST) announced Friday, that its Board of Directors has received an expression of interest from RDG Capital Fund Management and will carefully evaluate the expression of interest. Rosetta Stone's Board said the company is actively implementing its strategic plan, which it believes will deliver attractive value for shareholderRosetta Stone shares fell 18.5% Friday, closing at $7.62. Geeknet Confirms Superior Binding Offer from Strategic Buyer at $20/Share in CashThe Offer:Geeknet, Inc. (NASDAQ: GKNT) announced Friday, that its Board of Director's had determined that the previously announced offer from a strategic acquirer of $20.00 per share in cash, was superior to the previously announced agreement and plan of merger with Hot Topic, Inc. That offer was $17.50 per share in cash. Hot Topic was notified of the Board's decision and has until Monday June 1 to respond.Geeknet shares rose 5% Friday, closing at $19.90.Humana Reportedly Considering Sale Of Company",5/31/2015 19:37:00,Benzinga's Weekend M&A Chatter,The Rumor:,ALTR,,INTC,,,,,,,
rc79,2,"Shares of Humana (NYSE: HUM) soared Friday to all-time highs, on a report from the Wall Street Journal, that the company has received takeover interest from companies including Aetna (NYSE: AET) and Cigna (NYSE: CI). Sources say Humana is working with Goldman Sachs on a potential sale.Shares from other healthcare companies, including Anthem (NYSE: ANTM) and Molina (NYSE: MOH), also rose to new highs following the report. Omega Advisors' Leon Cooperman announced a new stake in Humana on May 15.Humana shares rose 20% Friday, closing at $214.65.Posted-In: News Rumors M&A Movers© 2015 Benzinga.com. Benzinga does not provide investment advice. All rights reserved.",5/31/2015 19:37:00,Benzinga's Weekend M&A Chatter,The Rumor:,HUM,,AET,CI,,,,,,
XR87,0,"The following are the M&A deals, rumors and chatter circulating on Wall Street for Thursday May 28, 2015:Hearing Unconfirmed Chatter of Potential Google Bid for Tesla",5/28/2015 18:20:00,"Benzinga's M&A Chatter for Thursday May 28, 2015",NA,,,,,,,,,,
XR87,1,"Shares of Tesla Motors, Inc. (NASDAQ: TSLA) rose Thursday on unconfirmed market chatter of a potential bid from Google Inc. (NASDAQ: GOOGL), according to sources. The offer is rumored to be in the range of $280 to $300 per share.Global Equities Research analyst Trip Chowdhry told Benzinga he didn't think such a deal was possible, though a strong partnership was more likely and already exists. Spokespersons for Google and Tesla did not respond to requests for comment.Tesla shares rose 1.5% Thursday, to close at $251.70.Avago Technologies to Acquire Broadcom in $37B Cash, Stock Deal",5/28/2015 18:20:00,"Benzinga's M&A Chatter for Thursday May 28, 2015",The Rumor:,TSLA,,GOOGL,,,,,,,
XR87,2,"Avago Technologies Limited (NASDAQ: AVGO) and Broadcom Corporation (NASDAQ: BRCM) announced Thursday, that Avago will acquire Broadcom for $17 billion in cash consideration and the economic equivalent of approximately 140 million Avago ordinary shares, valued at $20 billion as of May 27, 2015. Broadcom shareholders will have the ability to elect to receive, for each Broadcom share held: (i) $54.50 in cash; (ii) 0.4378 ordinary shares in a newly-formed Singapore holding company; (iii) a restricted equity security that is the economic equivalent of 0.4378 ordinary shares of HoldCo that will not be transferable or saleable for a period of one to two years after closing; or (iv) a combination thereof.The deal is expected to close by the end of Q1 of 2016.Broadcom shares fell 1.78% Thursday, closing at $56.14. Avago shares rose $0.89 to close at $142.38.Unconfirmed Market Chatter 3D Systems has Hired Goldman Sachs to Handle Potential Bid from GEThe rumor:Shares of 3D Systems Corporation (NYSE: DDD) rose Thursday on unconfirmed market chatter the company had hired Goldman Sachs in order to assist in handling a potential offer from General Electric Company (NYSE: GE). The rumored offer is $30 to $34 per share, according to sources.Spokespersons for 3D and GE were unavailable for comment.3D Systems shares rose 4.77% Thursday, closing at $22.42.Hearing Unconfirmed Chatter of Potential Nike Bid for Skechers",5/28/2015 18:20:00,"Benzinga's M&A Chatter for Thursday May 28, 2015",The Deal:,BRCM,,AVGO,,,,,,,
XR87,3,"Skechers USA Inc. (NYSE: SKX) shares rose 3% Thursday, following unconfirmed market chatter of a potential bid from Nike, Inc. (NYSE: NKE). Analysts from several firms, including Wunderlich seemed to dismiss the rumor. Spokespersons for Nike and Skechers did not respond to requests for comment.Skechers shares rose $3.01, closing at $106.86, while Nike shares fell $0.26, to close at $102.30.Twitter CEO Says Co Not Being Shopped AroundThe Interview:Twitter, Inc. (NYSE: TWTR) CEO Dick Costolo, speaking at Re/code's annual Code Conference in Rancho Palos Verdes, CA, said he is not shopping his company around. Rumors of potential buyers have been rampant for years, along with rumors that Costolo would be ousted as CEO. Costolo stated ""We have every intention of being an independent company. Those things you read about in the press are simply rumors, not facts.""Twitter shares rose $0.42 Thursday, closing at $36.83.Monsanto Could be Ready to Raise Bid for Syngenta",5/28/2015 18:20:00,"Benzinga's M&A Chatter for Thursday May 28, 2015",The Rumor:,SKX,,NKE,,,,,,,
XR87,4,"Shares of Syngenta AG (NYSE: SYT) spiked sharply higher on Thursday, following a Bloomberg report that the Swiss agrochemical manufacturer was preparing for a potentially higher offer from Monsanto Co. (NYSE: MON). Syngenta rejected a CHF449 bid from Monsanto on May 8.Syngenta reportedly added UBS as an advisor in preparation for a new Monsanto bid. One source said that Syngenta may consider an offer of CHF500, which calculates to about $110 per share for US-traded shares.Syngenta shares rose 2.5% Thursday, closing at $92.95. Monsanto shares rose as high as $120, closing at $118.60.Posted-In: News Rumors M&A Movers© 2015 Benzinga.com. Benzinga does not provide investment advice. All rights reserved.",5/28/2015 18:20:00,"Benzinga's M&A Chatter for Thursday May 28, 2015",The Rumor:,SYT,,MON,,,,,,,
dd22,0,"The following are the M&A deals, rumors and chatter circulating on Wall Street for Wednesday May 27, 2015:Teva, Paulson Could Teamup on Mylan Bid",5/27/2015 20:08:00,"Benzinga's M&A Chatter for Wednesday May 27, 2015",NA,,,,,,,,,,
dd22,1,"Teva Pharmaceutical Industries Limited (NYSE: TEVA) may enlist investor John Paulson as a partner in its bid for Mylan N.V. (NASDAQ: MYL), according to sources as reported by the NY Post on Wednesday. Mylan had rejected Teva's $82.00 per share offer, consisting of 50% cash and 50% Teva stock, last month.Teva disclosed, after the close, a 1.35% stake in Mylan and said it was prepared to meet with Mylan and its advisors to discuss a deal.Mylan shares rose 7% Wednesday, to close at $183.60, while Teva shares rose almost 3%, to close at $180.18.Broadcom Reportedly in Advanced Talks to be Acquired by Avago Technologies",5/27/2015 20:08:00,"Benzinga's M&A Chatter for Wednesday May 27, 2015",The Rumor:,MYL,,TEVA,,,,,,,
