Jm30,0,"The following are the M&A deals, rumors and chatter circulating on Wall Street for Monday March 16, 2015:Shanda Games Announces Consortium to Take Co. Private for $3.45/Share, $6.90/ADSThe Offer:Shanda Games Limited (NASDAQ: GAME) has been informed by Ningxia Yilida Capital Investment Limited Partnership that Ningxia Yilida, Ningxia, Orient Hongtai, Orient Hongzhi (Hong Kong) Limited and Hao Ding International Limited entered into a consortium agreement on March 16, 2015, pursuant to which they agreed to form a consortium to acquire the Company in a ""going private"" transaction at $3.45 per Class A or Class B ordinary share, or $6.90 per American depositary share.The Shanda Special Committee is reviewing the proposal and has not set a definitive timetable for the completion of its evaluation.Shanda Games shares closed at $6.38 Monday, a gain of 1.25%.Report P&G Could Potential Sell, Launch IPO of Beauty Brands",3/16/2015 19:11:00,"Benzinga's M&A Chatter for Monday March 16, 2015",NA,,,,,,,,,,
Jm30,1,"Shares of The Procter & Gamble Company (NYSE: PG) spiked higher Monday, on a report from Bloomberg, that P&G is exploring a sale or IPO of some of its beauty brands business, which includes Cover Girl and Herbal Essense. Sources also sale the company could consider a sale of its Wella hair-care business.A P&G spokesperson says Bloomberg's report is pure speculation.P&G shares rose 2% Monday, closing at $83.56.Valeant Raises Bid for Salix to $173/Share in CashThe Ameneded Agreement:Valeant Pharmaceuticals International, Inc. (NYSE: VRX) and Salix Pharmaceuticals, Ltd. (NASDAQ: SLXP) announced Monday, that they have entered into an amendment to their Plan of Merger, dated February 20, 2015. Valeant increased the offer price to acquire all the outstanding common stock of Salix from $158.00 per share to $173.00 per share in cash, for a total enterprise value of approximately $15.8 billion.The deal is expected to close by April 1.Following the announcement of the revised Valeant offer, Endo International plc (NASDAQ: ENDP) announced it was withdawing its offer to acquire Salix.Salix shares gained 2% Monday, closing at $172.75; Valeant shares gained 2.5%. to close at $202.34; Endo gained 2.5%, closing at $89.65. Leonard Green, TPG to Acquire Life Time Fitness for $72.10/Share",3/16/2015 19:11:00,"Benzinga's M&A Chatter for Monday March 16, 2015",The Rumor:,,,,,,,,,,
Jm30,2,"Life Time Fitness, Inc. (NYSE: LTM), Leonard Green & Partners and TPG, announced Monday, that they have entered into a definitive merger agreement under which affiliates of Leonard Green & Partners and TPG will acquire Life Time for $72.10 per share in cash. The transaction is valued at more than $4.0 billion.The deal is expected to close in Q3 of 2015.Life Time Fitness shares rose 5% Monday, closing at $70.68.Hearing Unconfirmed Market Chatter of Cisco $60/Share Bid for FireEye",3/16/2015 19:11:00,"Benzinga's M&A Chatter for Monday March 16, 2015",The Deal:,LTM,,,,,,,,,
Jm30,3,"Shares of FireEye rose Monday, on Unconfirmed market chatter of a potential bid from Cisco of $60.00 per share.Cisco declined comment on the rumor. FireEye did not respond to a request for comment. FireEye shares rose $0.33 Monday, closing at $42.37.Posted-In: News Rumors M&A Movers© 2015 Benzinga.com. Benzinga does not provide investment advice. All rights reserved.",3/16/2015 19:11:00,"Benzinga's M&A Chatter for Monday March 16, 2015",The Rumor:,FEYE,,CSCO,,,,,,,
Zr63,0,"The following are the M&A deals, rumors and chatter circulating on Wall Street for Friday March 13 through Sunday March 15, 2015:Conflicting Reports on Potential Whiting Sale",3/15/2015 18:27:00,Benzinga's Weekend M&A Chatter,NA,,,,,,,,,,
Zr63,1,"Shares of Whiting Petroleum (NASDAQ: CHTR) spiked sharply higher Friday, and were halted on a circuit-breaker, on a report from Bloomberg that the company has drawn interest from potential buyers, including ExxonMobil (NYSE: XOM), Continental Resources Inc (NYSE: CLR), Hess (NYSE: HES) and Statoil (NYSE: STO), according to sources.Reuters later reported that their sources said that Whiting was selling Texas acreage and pipeline assets as an alternative to a sale of the full company.Representatives for Whiting and Hess declined comment, while Exxon, Continental and Statoil did not immediately respond. The Wall Street Journal reported on March 7, that Whiting was seeking a buyer.There was unusual activity in the March $39 Whiting call on Friday morning.Whiting Petroleum shares closed at $40.00 Friday and traded as high as $41.37 after-hours.KKR, Varde, Deutsche Bank Acquire GE Capital Consumer Finance Unit for $6.3B",3/15/2015 18:27:00,Benzinga's Weekend M&A Chatter,The Rumor:,WLL,,XOM,CLR,HES,STO,0,,,
Zr63,2,"A consortium Värde Partners, KKR (NYSE: DB) and Deutsche Bank (NYSE: DB) have signed an agreement to acquire GE Capital's Australia and New Zealand Consumer Lending Business at an enterprise value of A$ 8.2 billion ($6.3 billion).The transaction is subject to customary regulatory approvals. Further terms of the deal were not disclosed.GE shares fell $0.36 Friday, closing at $25.04.Valeant Reportedly to Raise Bid for Salix to $160+/ShareThe Offer:Valeant Pharmaceuticals International (NYSE: VRX) is planning to raise its bid for Salix Pharmaceuticals Ltd. (NASDAQ: SLXP) to more than $160 per share, according to sources, as reported by the NY Times. Pershing Square Capital Management, ValueAct Capital and Valeant will team up to raise the offer for Valeant, the sources indicated.Valeant had agreed to acquire Salix for $158 a share in cash in February. Endo International plc (NASDAQ: ENDP) countered on March 11, with a bid of $175 per share, mostly in Endo shares.Pershing Square's Bill Ackman stated on Friday that Valeant would not overpay for Salix. Pershing Square reported a 5% stake in Valeant on March 9.Salix shares lost $0.65 Friday, closing at $169.40; Valeant shares gained 2.5%. to close at $197.43; Endo lost 3.5%, closing at $87.33. CRT Capital Acquires Sterne Agee's Institutional Equities Business",3/15/2015 18:27:00,Benzinga's Weekend M&A Chatter,The Deal:,,,,,,,,,,
Zr63,3,"Stifel Financial Corp. (NYSE: SF) and Sterne Agee Group, Inc. announced Sunday, that they have agreed to sell Sterne Agee's Institutional Equities business, including Equity Sales, Trading and Research to CRT Capital Group LLC. Financial terms were not disclosed. Stifel Financial shares fell $0.61 Friday, closing at $55.62.Posted-In: News Rumors M&A Movers© 2015 Benzinga.com. Benzinga does not provide investment advice. All rights reserved.",3/15/2015 18:27:00,Benzinga's Weekend M&A Chatter,The Deal:,,,,,,,,,,
zK08,0,"The following are the M&A deals, rumors and chatter circulating on Wall Street for Thursday March 12, 2015:Charter Communications in Talks to Acquire Bright House",3/12/2015 19:04:00,"Benzinga's M&A Chatter for Thursday March 12, 2015",NA,,,,,,,,,,
zK08,1,"Shares of Charter Communications (NASDAQ: CHTR) surged higher Thursday, on a Bloomberg report that the company was in talks to acquire BrightHouse Networks. A spokesperson for BrightHouse said company does not have an agreement with anyone, although they have had talks with multiple parties.Charter lost out to Comcast Corporation (NASDAQ: CMCSA) last year in a bid to acquire Time Warner Cable Inc. (NYSE: TWC).Charter Communications shares gained 6% Thursday, closing at $193.46. InMobi CEO Says No Plans to Sell Company to Google",3/12/2015 19:04:00,"Benzinga's M&A Chatter for Thursday March 12, 2015",The Rumor:,,,CHTR,,,,,1,,private company is target
zK08,2,"InMobi's founder and CEO, Naveen Tewari, told hisemployees in an email Thursday, that he has no plans to sell the company. Economic Times had reported that Google Inc. (NASDAQ: GOOG) was in talks to acquire the mobile advertising startup, according to sources. InMobi is reported to have been seeking $2 billion in a deal.Google shares rose $4.33 Thursday, closing at $555.51.EU Commission Clears ZF Friedrichshafen's Acquisition of TRWThe Approval:ZF Friedrichshafen received antitrust approval from the European Union Thursday for its proposed $13.5 billion acquisition of TRW Automotive Holdings Corp (NYSE: TRW), according to Reuters. The German car parts maker had agreed to sell TRW's chassis components unit in order to secure clearance.TRW shareholders approved the acquisition by ZF Friedrichshafen in November 2014. It is expected to close in H1 of 2015.TRW shares gained $0.40 Thursday, closing at $104.96. Posted-In: News Rumors M&A Movers© 2015 Benzinga.com. Benzinga does not provide investment advice. All rights reserved.",3/12/2015 19:04:00,"Benzinga's M&A Chatter for Thursday March 12, 2015",The Rumor:,,,GOOG,,,,,1,,negative on google acquiring a startup
NJ30,0,"The following are the M&A deals, rumors and chatter circulating on Wall Street for Wednesday March 11, 2015:KKR to Acquire Medical Group Holdings",3/11/2015 19:41:00,"Benzinga's M&A Chatter for Wednesday March 11, 2015",NA,,,,,,,,,,
NJ30,1,"Air Medical Group Holdings announced Wednesday, that funds managed by KKR & Co LP (NYSE: KKR), have signed a definitive agreement to acquire Air Medical from affiliates of Bain Capital and Brockway Moran & Partners. Financial terms of the transaction were not disclosed, although Reuters had reported Tuesday the deal would be valued at approximately $2 billion.The transaction is expected to close in Q2.KKR shares gained $0.05 Wednesday, closing at $22.87. Hearing Unconfirmed Potential Mylan Bid from Teva",3/11/2015 19:41:00,"Benzinga's M&A Chatter for Wednesday March 11, 2015",The Deal:,,,,,,,,,,
NJ30,2,"Shares of Mylan NV (NYSE: MYL) spiked higher Wednesday, on unconfirmed market chatter of a potential bid from Teva (NASDAQ: TEVA)A Teva spokesperson declined comment on the rumor. Mylan did not immediately respond to request for comment.Mylan shares rose 6.5% Wednesday, closing at $59.00>Endo Offers $175 in Cash, Stock for SalixThe Offer:Endo International plc (NASDAQ: ENDP) announced Wednesday, that it has submitted a proposal to the Board of Directors of Salix Pharmaceuticals Ltd. (NASDAQ: SLXP), to acquire all of the outstanding shares of common stock of Salix in a cash and stock transaction valued at $175.00 per Salix share. Salix previously entered a merger agreement with Valeant Pharmaceuticals International, Inc. (NYSE: VRX), dated February 20, 2015, under which which Salix stockholders would receive an amount in cash equal to $158.00 per share for each share of Salix common stock that they own.Salix Board of Directors confirmed receipt of the Endo offer and plans to review and consider it.Salix shares gained more than 7% Wednesday, closing at $169.62. Posted-In: News Rumors M&A Movers© 2015 Benzinga.com. Benzinga does not provide investment advice. All rights reserved.",3/11/2015 19:41:00,"Benzinga's M&A Chatter for Wednesday March 11, 2015",The Rumor:,MYL,,TEVA,,,,0,,,
Li77,0,"The following are the M&A deals, rumors and chatter circulating on Wall Street for Tuesday March 10, 2015:KKR in Talks to Acquire Air Medical Group Holdings for ~$2B",3/10/2015 19:44:00,"Benzinga's M&A Chatter for Tuesday March 10, 2015",NA,,,,,,,,,,
Li77,1,"KKR & Co LP (NYSE: KKR) is near a deal to acquire Air Medical Group Holdings from Bain Capital for about $2 billion, according to sources as reported by Reuters. A deal could be announced as early as this week.Spokespersons for KKR and Bain declined comment on the report. A spokesperson for Air Medical was not available.KKR shares lost 2% Tuesday, closing at $22.82. Bain Capital to Acquire Blue Coat Systems for ~$2.4B",3/10/2015 19:44:00,"Benzinga's M&A Chatter for Tuesday March 10, 2015",The Rumor:,,,KKR,,,,,0,,Private company is target
Li77,2,"Blue Coat Systems announced Tuesday, that it has entered into a definitive agreement to be acquired by funds advised by Bain Capital, in an all-cash transaction valued at approximately $2.4 billion. The deal is expected to close in H1 of 2015.Blue Coat is being acquired from Thoma Bravo, who took the company private in 2011. Rocketmiles Confirms Acquisition by Priceline",3/10/2015 19:44:00,"Benzinga's M&A Chatter for Tuesday March 10, 2015",The Deal:,,,,,,,,,,
Li77,3,"Rocketmiles CEO and co-founder Jay Hoffmann confirmed Tuesday to the Chicago Tribune, that the airline travel reward site has been acquired by The Priceline Group Inc. (NASDAQ: PCLN). The Wall Street Journal reported on February 18 that Priceline would acquire Rocketmiles for approximately $20 million.Priceline shares closed Tuesday at $1191.09, a loss of 2%.Posted-In: News Hedge Funds Rumors M&A Movers General© 2015 Benzinga.com. Benzinga does not provide investment advice. All rights reserved.",3/10/2015 19:44:00,"Benzinga's M&A Chatter for Tuesday March 10, 2015",The Deal:,,,,,,,,,,
iN40,0,"The following are the M&A deals, rumors and chatter circulating on Wall Street for Monday March 9, 2015:Simon Property Group Proposes Acquisition of Macerich for $91/Share in Cash, StockThe Offer:Simon Property Group, Inc. (NYSE: SPG) announced Monday, that it is offering to acquire all of the outstanding stock of Macerich for $91.00 per share in cash and Simon shares, for a total value of approximately $22.4 billion. Macerich shareholders will receive 50% in cash and 50% in SPG shares.In conjunction with the Macerich offer, Simon announced an agreement in principle to sell selected Macerich assets to General Growth Properties, Inc. (NYSE: GGP)Macerich confirmed receipt of the proposal from Simon and said its Board of Directors will review the proposal with its financial and legal advisors. Macerich stockholders are being advised to take no action at this time.Macerich shares gained 7.5% Monday, closing at $92.60. Pershing Square Buys 5% Stake In Valeant PharmaceuticalsThe Activist Stake:Pershing Square Holdings, Ltd. (OTC: PSHZF) announced Monday, as 4.9% stake in Valeant Pharmaceuticals International, Inc., (NYSE: VRX), representingapproximately 16.9% of the PSH portfolio. Pershing Square announced that various funds it manages have purchased 16,473,933 shares of Valeant.Pershing Square Holdings shares gained $0.15 Monday, closing at $27.75.Hearing Unconfirmed Market Chatter of Symantec $30+/Share Bid for Vasco Data Security",3/9/2015 18:48:00,"Benzinga's M&A Chatter for Tuesday March 9, 2015",NA,,,,,,,,,,
iN40,1,"Shares of Vasco Data Security (NASDAQ: VDSI) spiked higher Monday, on unconfirmed market chatter of a potential bid of more than $30 per share from Symantec Corporation (NASDAQ: SYMC).Spokespersons for Vasco and Symantec did not immediately respond to requests for comment.Vasco Data Security shares closed Monday at $23.01, a gain of 2%.Alcoa to Acquire RTI International Metals for $41.00/Share",3/9/2015 18:48:00,"Benzinga's M&A Chatter for Tuesday March 9, 2015",The Rumor:,VDSI,,SYMC,,,,0,,,
iN40,2,"Alcoa (NYSE: AA) announced Monday, it has signed a definitive agreement to acquire RTI International Metals, Inc. (NYSE: RTI), in a stock-for-stock transaction with an enterprise value of $1.5 billion. RTI shareholders will receive 2.8315 Alcoa shares for each RTI share, representing a value of $41 per RTI share based on Alcoa's closing price on March 6, 2015. RTI shareholders must approve the deal.Alcoa shares closed Monday at $13.70, a loss of more than 5%.Gaming and Leisure Properties Offers to Acquire Pinnacle's Real Estate AssetsThe Offer:Gaming and Leisure Properties, Inc. (NASDAQ: GLPI) announced Monday, that it has sent a letter to the Board of Directors of Pinnacle Entertainment, Inc. (NYSE: PNK) conveying GLPI's offer to acquire the real estate assets of Pinnacle for GLPI shares in a transaction with an enterprise value of $4.1 billion, including assumption of debt. Pinnacle shareholders would receive one share of OpCo common stock and 0.5517 shares of GLPI common stock for each share of Pinnacle they own, for an aggregate value of about $36 per share.Under the GLPI offer, following the spin-off of OpCo, Pinnacle's real estate assets would be merged into GLPI and OpCo would enter into a mutually agreeable master lease agreement with GLPI. The transaction is expected to close prior to the end of 2015. Pinnacle Entertainment shares closed Monday at $31.61, a gain of 15%. Gaming and Leisure shares rose more than 12%, closing at $36.46.Posted-In: News Rumors M&A Movers© 2015 Benzinga.com. Benzinga does not provide investment advice. All rights reserved.",3/9/2015 18:48:00,"Benzinga's M&A Chatter for Tuesday March 9, 2015",The Rumor:,,,,,,,,,,not a rumor
VW86,0,"The following are the M&A deals, rumors and chatter circulating on Wall Street for Friday March 6 throught Sunday March 8, 2015:Macerich Spikes Higher on Simon Shelf Filing",3/8/2015 21:49:00,Benzinga's Weekend M&A Chatter,NA,,,,,,,,,,
VW86,1,"Shares of The Macerich Company (NYSE: MAC) spiked higher Friday, as Simon Property Group Inc. (NYSE: SPG) for a potential mixed shelf offering. The offering size was not disclosed. The Wall Street Journal reported on March 4, that Simon had made multiple takeover approaches to Macerich. The most recent contact was made in the past few weeks, according to sources. Simon reported a 3.6% stake in Macerich in November.Macerich shares lost 1.5% Friday, closing at $86.72. iKang Acquires 70% Stake in WA Health",3/8/2015 21:49:00,Benzinga's Weekend M&A Chatter,The Rumor:,MAC,,SPG,,,,0,0,,
VW86,2,"iKang Healthcare Group, Inc. (NASDAQ: KANG) announced Friday, that it has acquired a 70% equity interest in WA Centers HK Limited. Terms were not disclosed.iKang shares gained almost 3% Friday, closing at $17.32.News Corp Acquires VCCircle",3/8/2015 21:49:00,Benzinga's Weekend M&A Chatter,The Deal:,,,,,,,,,,
VW86,3,"News Corp (NASDAQ: NWSA) announced Sunday, an agreement to acquire the VCCircle Network, including VCCircle.com, Techcircle.in, VCCEdge and VCCircle Training. Terms were not disclosed.The deal is expected to close in March.News Corp shares closed Friday at $16.83, a loss of 1.5%.Posted-In: News Rumors M&A Movers© 2015 Benzinga.com. Benzinga does not provide investment advice. All rights reserved.",3/8/2015 21:49:00,Benzinga's Weekend M&A Chatter,The Deal:,,,,,,,,,,
ED77,0,"The following are the M&A deals, rumors and chatter circulating on Wall Street for Thursday March 5, 2015:AbbVie to Acquire Pharmacyclics for $261.25/Share in Cash, Stock",3/5/2015 20:07:00,"Benzinga's M&A Chatter for Thursday March 5, 2015",NA,,,,,,,,,,
ED77,1,"AbbVie (NYSE: ABBV) and Pharmacyclics (NASDAQ: PCYC) announced late Wednesday, a definitive agreement whereby AbbVie will acquire Pharmacyclics for $261.25 per share comprised in cash and AbbVie shares. Through a tender offer, AbbVie will offer to acquire all of the outstanding shares of Pharmacyclics' common stock for $261.25 per share, consisting of approximately 58% cash and 42% AbbVie common stock. The deal is expected to close in mid-2015. Pharmacyclics shares gained more than 10% Thursday, closing at $254.22. Ingersoll Rand Acquires FRIGOBLOCK for 100M",3/5/2015 20:07:00,"Benzinga's M&A Chatter for Thursday March 5, 2015",The Deal:,,,,,,,,,,
ED77,2,"Ingersoll-Rand plc (NYSE: IR) announced Thursday, it has completed the acquisition of FRIGOBLOCK for 100 million.. The deal closed on March 4, 2015. Ingersoll Rand shares closed Thursday at $67.68, a gain of 1%.Citigroup Completes Sale of 9.9% Stake in Akbank for ~$1.15B",3/5/2015 20:07:00,"Benzinga's M&A Chatter for Thursday March 5, 2015",The Deal:,,,,,,,,,,
ED77,3,"Citigroup Inc. (NYSE: C) announced Thursday, that it has sold 396 million common shares in Akbank through an equity offering representing its entire 9.9% equity interest in the company for proceeds from of approximately $1.15 billion.Citigroup shares Thursday at $53.56, down $0.11.Mallinckrodt Pharmaceuticals to Acquire Ikaria for $2.3B",3/5/2015 20:07:00,"Benzinga's M&A Chatter for Thursday March 5, 2015",The Deal:,,,,,,,,,,
ED77,4,"Mallinckrodt plc (NYSE: MNK) and privately-held critical care company, Ikaria, announced Thursday, that Mallinckrodt will acquire from a Madison Dearborn-led investor group in a transaction valued at approximately $2.3 billion. The deal is expected to closed in early Q2 of 2015.Mallinckrodt closed Thursday at $121.70, up $5.51.Rumor of VF Corp Acquisition of Lululemon",3/5/2015 20:07:00,"Benzinga's M&A Chatter for Thursday March 5, 2015",The Deal:,,,,,,,,,,
ED77,5,"Shares of Lululemon Athletica Inc. (NASDAQ: LULU) rose Thursday, on unconfimred market chatter of a potential bid from V.F. Corporation (NYSE: VFC). The rumored offer is $84.00 per share in cash and stock.Nike, Inc. (NYSE: NKE) has previously been mentioned as a possible buyer for the manufacturer of athletic apparel.Spokespersons for Lululemon and V.F. Corporation did not respond to requests for comment.Lululemon closed Thursday at $64.85, down $0.67.Rumor of Navistar Acquisition Interest by European Automakers",3/5/2015 20:07:00,"Benzinga's M&A Chatter for Thursday March 5, 2015",The Rumor:,LULU,,VFC,,,,0,,,
ED77,6,"Shares of Navistar International Corporation (NYSE: NAV) surged higher Thursday on an unconfirmed rumor that several European automakers, including AB Volvo (OTC: VOLVY), Volkswagen AG (OTC: VLKAY) and Daimler AG (OTC: DDAIF) were considering a bid for the manufacturer of commercial trucks, buses, defense vehicles and engines.Navistar declined comment on the rumor.Navistar shares closed Thursday at $30.30, up $1.57.Posted-In: News Rumors M&A Movers© 2015 Benzinga.com. Benzinga does not provide investment advice. All rights reserved.",3/5/2015 20:07:00,"Benzinga's M&A Chatter for Thursday March 5, 2015",The Rumor:,NAV,,VOLVY,VKLAY,DDAIF,,0,,,
Kq35,0,"The following are the M&A deals, rumors and chatter circulating on Wall Street for Wednesday March 4, 2015:Bain Capital, Golden Gate Reportedly Seeking Ann Taylor Deal",3/4/2015 20:47:00,"Benzinga's M&A Chatter for Wednesday March 4, 2015",NA,,,,,,,,,,
Kq35,1,"Shares of ANN INC. (NYSE: ANN) surged higher Wednesday, on a report from Reuters that PE firms Bain Capital and Golden Gate Capital are competing to acquire the woman's retailer. The report says a deal is not a certainty due to a lack of available debt for buyouts of apparel retailers.Spokespersons for Ann, Bain and Golden Gate declined comment.Ann, Inc. shares gained more than 6% Wednesday, closing at $37.40. Avago Sought Freescale Deal, Still Seeking Large Acquisition",3/4/2015 20:47:00,"Benzinga's M&A Chatter for Wednesday March 4, 2015",The Rumor:,ANN,,,,,,0,,,private acquirer
Kq35,2,"Shares of Avago Technologies Limited (NASDAQ: AVGO) rose Wednesday on a report from Reuters, that the Singapore-based semiconductor company had attempted to acquire Freescale Semiconductor, Ltd. (NYSE: FSL), but lost out to NXP Semiconductors NV (NASDAQ: NXPI), according to sources. The report said that Avago was still in the market for a large deal. Call options in several related companies were active following the report, including Atmel Corporation (NASDAQ: ATML) and Linear Technology Corporation (NASDAQ: LLTC).A spokesperson for Avago was not immediately available for comment.Avago Technologies shares closed Wednesday at $129.40, a gain of almost 1%.J&J Acquisition of Pharmacyclics Could be Announced Thursday",3/4/2015 20:47:00,"Benzinga's M&A Chatter for Wednesday March 4, 2015",The Rumor:,,,,AVGO,,,,1,,
Kq35,3,"Shares of Pharmacyclics Inc. (NASDAQ: PCYC) spiked as high as $248.49 after-hours Wednesday, on a report from Financial Times, that Johnson & Johnson (NYSE: JNJ) could acquire its Imbruvica partner. Bloomberg, which first reported on February 25 that Pharmacyclics was considering a sale, reported late Wednesday that a deal could be announced as early as Thursday.Spokespersons for J&J and Pharmacyclics declined comment on the report.Pharmacyclics closed the regular session Wednesday at $230.48, up $13.71.EU Antitrust Regulators Set to Approve ZF Friedrichshafen's Acquisition of TRW",3/4/2015 20:47:00,"Benzinga's M&A Chatter for Wednesday March 4, 2015",The Rumor:,PCYC,,JNJ,,,,0,,,
Kq35,4,"Shares of TRW Automotive Holdings Corp. (TRW) NYSE spiked higher Wednesday, on a report from Reuters, that EU antitrust regulators are about to approve ZF Friedrichshafen's 13.5 billion takeover of the Livonia, Michigan company. This is a conditional phase 1 approval, according to a source.TRW closed Wednesday $104.50, up $0.27.Simon Approaches Macerich Regarding Takeover",3/4/2015 20:47:00,"Benzinga's M&A Chatter for Wednesday March 4, 2015",The Rumor:,TRW,,,,,,0,,,
Kq35,5,"Simon Property Group Inc. (NYSE: SPG) has approached The Macerich Company (NYSE: MAC) in recent weeks, seeking a potential merger, according to sources as reported by the Wall Street Journal. That follows another approach in late 2014.Simon disclosed a 3.6% stake in Macerich in November.Simon hasn't made a formal offer for MacerichTRW closed Wednesday $104.50, up $0.27.Posted-In: News Rumors M&A Movers© 2015 Benzinga.com. Benzinga does not provide investment advice. All rights reserved.",3/4/2015 20:47:00,"Benzinga's M&A Chatter for Wednesday March 4, 2015",The Rumor:,MAC,,SPG,,,,,,,
Vm83,0,"The following are the M&A deals, rumors and chatter circulating on Wall Street for Tuesday March 3, 2015:Springleaf Financial to Acquire OneMain Financial in $4.25B Deal",3/3/2015 19:35:00,"Benzinga's M&A Chatter for Tuesday March 3, 2015",NA,,,,,,,,,,
