wP36,1,"21st Century Fox, Inc. (NASDAQ: FOXA) announced Wednesday that it has reached a preliminary agreement to acquire video advertising company true[X] media. Terms were not disclosed, but The Wall Street Journal reported the purchase price at $200 million.Twenty-First Century Fox shares closed Wednesday at $37.23, a gain of almost 3%.Varian Medical Systems to Acquire MeVis Medical Solutions for 17.50/Share",12/17/2014 19:17:00,"Benzinga's M&A Chatter for Wednesday December 17, 2014",The Deal:,,,,,,,,,,
wP36,2,"Varian Medical Systems (NYSE: VAR) announced Wednesday, it intends to submit an offer to acquire MeVis Medical Solutions AG. Varian affiliate, VMS Deutschland Holdings GmbH, will make a voluntary public tender offer to all MeVis shareholders to acquire their non-par value registered shares at 17.50 per share, for a total payment of 30 million for all outstanding shares.The deal is expected to be completed in April, 2015. Varian Medical shares closed Wedneday at $86.08, a gain of 1%. Shire considering bid for NPS Pharmaceuticals",12/17/2014 19:17:00,"Benzinga's M&A Chatter for Wednesday December 17, 2014",The Deal:,,,,,,,,,,
wP36,3,"Shares of NPS Pharmaceuticals, Inc. (NASDAQ: NPSP) soared Wednesday, on a report from Bloomberg, that Shire plc (NASDAQ: SHPG) is considering a bid for the Bedminster, NJ biopharmaceutical company. According to sources, an offer would depend on whether the FDA approves NPS's Natpara, its hormone replacement therapy.Shire and NPS did not respond to requests for comment on the report.NPS shares gained 18% Wednesday, to close at $36.10.Posted-In: News Rumors M&A Movers© 2015 Benzinga.com. Benzinga does not provide investment advice. All rights reserved.",12/17/2014 19:17:00,"Benzinga's M&A Chatter for Wednesday December 17, 2014",The Rumor:,,,,,,,,,,
iI90,0,"The following are the M&A deals, rumors and chatter circulating on Wall Street for Tuesday December 16, 2014Report Pantry Close to $1B Sale",12/16/2014 18:51:00,"Benzinga's M&A Chatter for Tuesday December 16, 2014",NA,,,,,,,,,,
iI90,1,"Shares of The Pantry, Inc. (NASDAQ: PTRY) rose 12% after-hours Tuesday, on a Wall Street Journal report that the company is close to a deal to be acquired for as much as $1 billion, according to sources. Pantry has reportedly hired an investment bank and bids were submitted last week. Sources say a deal could be announced within days.Pantry shares closed Tuesday at $28.85, and traded as high as $34.00 after hours.Citgo Receiving Bids Valuing Co at ~$10B",12/16/2014 18:51:00,"Benzinga's M&A Chatter for Tuesday December 16, 2014",The Rumor:,,,,,,,,,,
iI90,2,"Venezuela's Citgo Petroleum Corp has received revised bids from at least four companies, including Marathon Petroleum Corp (NYSE: MPC), Valero Energy Corp (NYSE: VLO) and HollyFrontier Corp (NASDAQ: HFC), that could value Citgo at more than $10 billion, according to a report from Reuters. Sources say some of the bids were above the $10 billion level, while others were less than $7 billion.There is uncertainty as to whether the Venezuelan government will sell Citgo. Citgo declined comment on the report.Repsol to Acquire Talisman Energy for $8.00/Share In Cash",12/16/2014 18:51:00,"Benzinga's M&A Chatter for Tuesday December 16, 2014",The Rumor:,,,,,,,,,,
iI90,3,"Talisman Energy (NYSE: TLM) announced Tuesday, that it has entered into a definitive agreement, under which Repsol, S.A. (OTC: REPYY) will acquire all of the outstanding common shares of Talisman for US$8.00 per share in cash. The Talisman Board has unanimously approved the transaction; Talisman's common shareholders and preferred shareholders will vote on the transaction at a special meeting of shareholders to be held mid-February 2015.Talisman shares gained 48% Tuesday, to close at $7.58.Posted-In: News Rumors M&A Movers© 2015 Benzinga.com. Benzinga does not provide investment advice. All rights reserved.",12/16/2014 18:51:00,"Benzinga's M&A Chatter for Tuesday December 16, 2014",The Deal:,,,,,,,,,,
XA18,0,"The following are the M&A deals, rumors and chatter circulating on Wall Street for Monday December 15, 2014Hearing Renewed Chatter or Potential Publix Bid for Whole Foods",12/15/2014 18:18:00,"Benzinga's M&A Chatter for Monday December 15, 2014",NA,,,,,,,,,,
XA18,1,"Shares of Whole Foods Market, Inc. (NYSE: WFM) rose Monday, on renewed chatter of a possible bid from Publix. The rumor is that Publix will offer more than $60 per share for Whole Foods.A spokesperson for Publix said it was just a rumor. Whole Foods did not respond to a request for a comment.Whole Foods shares closed Monday at $48.54, a gain of $0.22.Riverbed to be Acquired by Thoma Bravo for $21/Share in Cash",12/15/2014 18:18:00,"Benzinga's M&A Chatter for Monday December 15, 2014",The Rumor:,,,,,,,,,,
XA18,2,"Riverbed Technology (NASDAQ: RVBD) announced Monday, that it has entered an agreement to be acquired by PE firm Thoma Bravo, LLC and Teachers' Private Capital unit of Ontario Teachers' Pension Plan, for $21.00 per share in cash, or approximately $3.6 billion. The deal was unanimously approved by Riverbed's Board of Directors following a strategic review process.Riverbed shares closed Monday at $20.31, a gain of 8%.Talisman Confirms Discussions with RepsolThe Talks:Talisman Energy Inc. (NYSE: TLM) confirmed Monday, that it is engaged in discussions with Repsol, S.A. (OTC: REPYY) regarding a potential corporate transaction. Talisman said it has also been approached by other parties regarding, including, according to Bloomberg, Canada Pension.Spanish publication Expansion reported Monday that Repsol's Board was meeting to approve an offer for Talisman. Reports says the offer could be between C$6.00 and C$8.00 per share. After-hours Reuters reported that Repsol's Board had approved an offer for Talisman and Talisman's Board was reviewing the offer.Talisman shares gained 19% Monday, to close at $5.12, and traded at $5.42 after-hours.Posted-In: News Rumors M&A Movers© 2015 Benzinga.com. Benzinga does not provide investment advice. All rights reserved.",12/15/2014 18:18:00,"Benzinga's M&A Chatter for Monday December 15, 2014",The Deal:,,,,,,,,,,
eq74,0,"The following are the M&A deals, rumors and chatter circulating on Wall Street for Friday December 12 through Sunday December 14, 2014Apollo Global to Acquire PetSmart for $83/Share in Cash",12/14/2014 21:35:00,Benzinga's Weekend M&A Chatter,NA,,,,,,,,,,
eq74,1,"PetSmart, Inc. (NASDAQ: PETM) confirmed Sunday, that it has reached agreement to be acquired by a consortium led by BC Partners for $83.00 per share in cash. The consortium includes Funds advised by BC Partners, alongside several of its limited partners, including La Caisse de dépôt et placement du Québec and StepStone. The deal is expected to close in H1 of 2015.Both the NY Post and Bloomberg had reported that Apollo Global Management was near a deal to acquire the supply retailer for approximately $8 billion.Jana Partners, which has a 9.8% stake in PetSmart and has been pressing for a takeover, declined comment initially. PetSmart shares were priced at around $60 when Jana's stake was announced on July 3. PetSmart shares closed Friday at $77.67, a loss of about 1%.Recall Holdings Rejects Unsolicited A$7.00/Share Acquisition Proposal from Iron MountainThe Rejection:Recall Holdings Limited (OTC: RCLHF) announced Sunday, that its Board of Directors has unanimously rejected a non-binding indicative proposal from Iron Mountain Incorporated (NYSE: IRM) to acquire Recall, for A$7.00 per Recall share in cash and stock. The Board said Iron Mountain's proposal does not reflect the fundamental value of Recall. Iron Mountain shares closed Friday at $36.44, a loss of almost 2%.Technip Drops Plan to Acquire CGGThe Withdrawal:Technip SA (OTC: TKPYY) announced Sunday, that it does not intend to file a tender offer for CGG (NYSE: CGG). Technip had approached CGG's Board of Directors on November 10, 2014 regarding a potential offer for CGG and sought to engage in a constructive dialogue. CGG's did not respond positively to the approach, Technip suggested alternative options which did not result in any form of agreement.CGG shares lost 3.73% Friday, closing at $8.52.Posted-In: News Rumors M&A Movers© 2015 Benzinga.com. Benzinga does not provide investment advice. All rights reserved.",12/14/2014 21:35:00,Benzinga's Weekend M&A Chatter,The Deal:,,,,,,,,,,
kF77,0,"The following are the M&A deals, rumors and chatter circulating on Wall Street for Thursday December 11, 2014Starboard Value Wants to Merge Staples, Office DepotThe Investor Stake:Shares of Staples, Inc. (NASDAQ: SPLS) rose more than 8% Thursday, while shares of Office Depot, Inc. (NYSE: ODP) rose 12%, as activist investor Starboard Value increased its stake in Office Depot and announced a stake in Staple. Starboard confirmed Thursday that it had taken a 6% stake in Staples and raised its stake in Office Depot to 9.9%. The actions were rumored late Wednesday, in a report from the Wall Street Journal. The publication hinted that Starboard possibly had a merger of the two office supply chains on its agenda. The same rumor was repeated today by CNBC and by Bloomberg. There was heavy call activity in Staples in the week leading up to today's announcement.Spokespersons for Staples, Office Depot and Starboard Value did not respond to requests for comment.Staple shares gained $1.29 Thursday, to close at $16.10; Office Depot shares gained $0.82 to close at $7.54.Sysco Said Ready to Complete $8.2B Merger with US Foods",12/11/2014 18:29:00,"Benzinga's M&A Chatter for Thursday December 11, 2014",NA,,,,,,,,,,
kF77,1,"Shares of Sysco Corporation (NYSE: SYY) spiked higher Thursday, on report from the NY Post that it is ready to complete its merger deal with US Foods, valued at $8.2 billion. According to sources, Sysco is selling assets worth $5 billion to Performance Food Group, in order to obtain regulatory approval. Sysco originally agreed to sell $2 billion worth of assets.A Spokesperson for Sysco declined comment. Sysco shares closed Thursday at $40.13, a gain of $0.72.Hearing Unconfirmed Market Chatter of 20% Pepsi Stake in SodaStream",12/11/2014 18:29:00,"Benzinga's M&A Chatter for Thursday December 11, 2014",The Rumor:,,,,,,,,,,
kF77,2,"SodaStream International Ltd. (NASDAQ: SODA) shares rose Thursday on unconfirmed market chatter that Pepsico, Inc. (NYSE: PEP) has taken a 20% stake in the maker of home beverage machines. The investment is said to be valued at $30 per share, according to sources. SodaStream has previously been the subject of frequent chatter involving Pepsi, The Coca-Cola Company (NYSE: KO) and private equity.A SodaStream spokesperson declined comment on the rumor. Pepsico did not respond to a request for comment.SodaStream shares gained 3% Thursday, closing at $20.74.Posted-In: News Hedge Funds Rumors Insider Trades M&A Movers General© 2015 Benzinga.com. Benzinga does not provide investment advice. All rights reserved.",12/11/2014 18:29:00,"Benzinga's M&A Chatter for Thursday December 11, 2014",The Rumor:,,,,,,,,,,
vp39,0,"The following are the M&A deals, rumors and chatter circulating on Wall Street for Wednesday December 10, 2014Hearing Unconfirmed Market Chatter of Potential BHP Bid for Mosaic at $56/Share",12/10/2014 21:42:00,"Benzinga's M&A Chatter for Wednesday December 10, 2014",NA,,,,,,,,,,
vp39,1,"Shares of The Mosaic Company (NYSE: MOS) rose Wednesday, on unconfirmed market chatter of a potential bid from BHP Billiton Limited (NYSE: BHP) of $56.00 per share. Sources report Mosaic is considering the offer. A Mosaic spokesperson declined comment on the rumor. A BHP spokesperson was unavailable for comment.Mosaic shares closed Wednesday at $45.91, a gain of 1%.Report of Potential $15B Bid for TIM",12/10/2014 21:42:00,"Benzinga's M&A Chatter for Wednesday December 10, 2014",The Rumor:,,,,,,,,,,
vp39,2,"Shares of TIM Participacoes S.A. (TSU) spiked higher Wednesday, following a Bloomberg report that Oi SA (NYSE: OIBR), Telefonica SA (NYSE: TEF) and Claro SA are planning to make an offer that would value TIM at around $15 billion, according to sources. Oi has agreed to sell its Portuguese assets to Altice SA ahead of a potential deal.Spokespersons for the parties declined comment on the report.TIM Participacoes shares closed Wednesday at $23.49, a gain of $1.27.Tyco Acquires Industrial Safety Technologies For $329.5M In Cash",12/10/2014 21:42:00,"Benzinga's M&A Chatter for Wednesday December 10, 2014",The Rumor:,,,,,,,,,,
vp39,3,"Tyco International plc (NYSE: TYC) announced Wednesday that it has agreed to acquire maker gas and flame detection gear, Industrial Safety Technologies, from Battery Ventures, for $329.5 million in cash. The transaction is expected to close in Tyco's FY Q2.Tyco closed Wednesday at $42.40, a loss of 2%.Posted-In: News Rumors M&A Movers© 2015 Benzinga.com. Benzinga does not provide investment advice. All rights reserved.",12/10/2014 21:42:00,"Benzinga's M&A Chatter for Wednesday December 10, 2014",The Deal:,,,,,,,,,,
SL46,0,"The following are the M&A deals, rumors and chatter circulating on Wall Street for Tuesday December 9, 2014Santander Considering Buyout of Santander Consumer USA",12/9/2014 17:20:00,"Benzinga's M&A Chatter for Tuesday December 9, 2014",NA,,,,,,,,,,
SL46,1,"Shares of Santander Consumer USA (NYSE: SC) spiked higher Tuesday, before being halted on a circuit-breaker. Bloomberg reported that Banco Santander, S.A. (NYSE: SAN) could bid to take over the consumer finance company that had its IPO in January 2014. Santander Consumer shares have been trading below the $24 offering price since April.Banco Santander issued a statement later that it is not considering that option. Santander Consumer USA closed Tuesday at $18.61, a gain of $0.31.Traders Feel Zoetis is a Takeover Target of Sanofi",12/9/2014 17:20:00,"Benzinga's M&A Chatter for Tuesday December 9, 2014",The Rumor:,,,,,,,,,,
SL46,2,"Shares of Zoetis (NYSE CCO) spiked higher Tuesday, following comments from Sanofi (NYSE SNY) CEO Serge Weinberg that the company is ready to make acquisitions in vetinary medicine. Bill Ackman reported a 8.3% stake in Zoetis as of December 5.A Zoetis spokesperson did not respond to a request for comment.Zoetis shares closed Tuesday at $43.82, a loss of $0.28.Talisman Confirms Repsol ApproachThe Confirmation:Talisman Energy Inc. (NYSE: TLM) acknowledged Tuesday, that it has been approached by a number of parties, including Repsol, S.A. (OTC: REPYY), with regards to various transactions. Talisman said there is no assurance that any transaction will be agreed to.Talisman was responding to a Bloomberg report on Monday that the company had resumed talks with Repsol regarding a potential sale of assets or the entire company.Talisman Energy closed Tuesday at $4.22, a gain of almost 13%.Posted-In: News Rumors Asset Sales M&A Movers© 2015 Benzinga.com. Benzinga does not provide investment advice. All rights reserved.",12/9/2014 17:20:00,"Benzinga's M&A Chatter for Tuesday December 9, 2014",The Rumor:,,,,,,,,,,
bb55,0,"The following are the M&A deals, rumors and chatter circulating on Wall Street for Monday Decmeber 5 throught Sunday December 7, 2014:Merck to Acquire Cubist for $102/Share in Cash",12/8/2014 18:27:00,"Benzinga's M&A Chatter for Monday December 8, 2014",NA,,,,,,,,,,
bb55,1,"Merck (NYSE: MRK) and Cubist Pharmaceuticals, Inc. (NASDAQ: CBST) confirmed Monday that Merck will acquire Cubist for $102 per share in cash, in a transaction valued $8.4 billion, plus $1.1 billion in net debt. Merck, through a subsidiary, will initiate a tender offer to acquire all outstanding shares of Cubist.The deal is expected to close in Q1 of 2015.Cubist shares closed Monday at $100.60, a gain of 35%.JCDecaux Explores Offer for European Assets of Clear Channel Outdoor According to Sources",12/8/2014 18:27:00,"Benzinga's M&A Chatter for Monday December 8, 2014",The Deal:,,,,,,,,,,
bb55,2,"Shares of Clear Channel Outdoor Holdings Inc. (NYSE CCO) spiked higher Monday, on a report from Reuters, that JCDecaux SA (OTC: JCDCXY) is considering bid for the European assets of it U.S. outdoor advertising rival. JCDecaux is the world's largest outdoor ad group.Clear Channel Outdoor's European assets could be valued at $2.5 billion, according to sources. A Clear Channel spokesperson did not respond to a request for comment.Clear Channel Outdoor shares closed Monday at $8.26, a gain of $0.14.Repsol Has Revived Talks with Talisman",12/8/2014 18:27:00,"Benzinga's M&A Chatter for Monday December 8, 2014",The Rumor:,,,,,,,,,,
bb55,3,"Shares of Talisman Energy Inc. (NYSE: TLM) spiked higher Monday, on a report from Bloomberg, that talks with Spain's Repsol, SA (OTC: REPYY) have been resumed, according to sources. The talks may involve a sale of assets or the entire company.Bloomberg reported back in July that Talisman was one of several companies being considered as an acquisition target by Repsol. A spokesperson for Talisman Energy was not immediately available for comment.Talisman Energy closed Monday at $3.74, a loss of 5% on twice average volume.Apple Rumored to be Considering Stake in Twitter",12/8/2014 18:27:00,"Benzinga's M&A Chatter for Monday December 8, 2014",The Rumor:,,,,,,,,,,
bb55,4,"Shares of Twitter, Inc. (NYSE: TWTR) rose Monday, on unconfirmed market chatter that Apple Inc. (NASDAQ: AAPL) might take a 25% stake in the social media platform. The stake could be valued at $47.00 per share.This is not the first time Apple has reportedly considered a stake in Twitter. In 2012, a report mentioned a possible stake in Twitter by Apple at less than half the current $22 billion market cap.Twitter declined comment on the rumor. An Apple spokesperson was not available for comment.Twitter closed Monday at $36.29, a loss of more than 5.5%.Posted-In: News Rumors M&A Movers© 2015 Benzinga.com. Benzinga does not provide investment advice. All rights reserved.",12/8/2014 18:27:00,"Benzinga's M&A Chatter for Monday December 8, 2014",The Rumor:,,,,,,,,,,
ga24,0,"The following are the M&A deals, rumors and chatter circulating on Wall Street for Friday Decmeber 5 throught Sunday December 7, 2014:Merck in Talks to Acquire Cubist for ~$100/Share",12/7/2014 18:24:00,Benzinga's Weekend M&A Chatter,NA,,,,,,,,,,
ga24,1,"Merck & Co Inc. (NYSE: MRK), is reportedly in talks to acquire Lexington, MA-based Cubist Pharmaceuticals Inc. (NASDAQ: CBST) for around $7.5 billion, or approximately $100 per share according to the NY Times DealBook. A deal could be announced as early as next week, according to persons familiar with the matter.Cubist shares closed Friday at $74.36, down $0.16.Open Text to Acquire Actuate for $6.60/Share",12/7/2014 18:24:00,Benzinga's Weekend M&A Chatter,The Rumor:,,,,,,,,,,
ga24,2,"OpenText Corporation (NASDAQ: OTEX) announced Frday, an agreement to acquire Actuate Corporation (NASDAQ: BIRT) for $6.60 per share in cash, for a total equity value of approximately $330 million. OpenText will commence a tender offer for all of the shares of common stock of Actuate within 7 business days. The deal is expected to close in Q3 of OpenText's fiscal 2015.Actuate shares closed Friday at $6.55, a gain of 87%.Chatter of Potential Pfizer Bid for Bristol Myers Squibb",12/7/2014 18:24:00,Benzinga's Weekend M&A Chatter,The Deal:,,,,,,,,,,
ga24,3,"Shares of Bristol-Myers Squibb Company (BMY) rose in early trading Friday, on unconfirmed market chatter of a potential bid from Pfizer Inc. (NYSE: PFE). Pfizer could offer up to $72.00 per share for the New York-based biopharmaceutical company. Spokespersons for Bristol Myers Squibb and Pfizer declined comment on the rumor.Bristol Myers Squibb closed Friday at $60.65, a gain of 3%.Posted-In: News Rumors M&A Movers© 2015 Benzinga.com. Benzinga does not provide investment advice. All rights reserved.",12/7/2014 18:24:00,Benzinga's Weekend M&A Chatter,The Rumor:,,,,,,,,,,
Fw60,0,"The following are the M&A deals, rumors and chatter circulating on Wall Street for Thursday December 4, 2014:UTI, DSV Confirm Talks Took Place, But EndedThe Confirmation:Both UTi Worldwide Inc. (NASDAQ: UTIW) and Denmark's DSV A/S (OTC: DSDVY), confirmed Thursday that the companies had engaged in preliminary discussions, and not the advanced talks reported by Bloomberg on Wednesday. Both companies also said that there are currently no ongoing talks between the two.Shares of UTi Worldwide closed Thursday at $12.87, a loss of 7%.Hearing Unconfirmed Takeover Chatter in US Steel",12/4/2014 18:21:00,"Benzinga's M&A Chatter for Thursday December 4, 2014",NA,,,,,,,,,,
Fw60,1,"Shares of United States Steel Corp. (NYSE: X) rose Thursday, on renewed takeover chatter. ArcelorMittal (NYSE: MT) has been mentioned frequently as a potential buyer.A spokesperson for US Steel declined comment on the rumor.US Steel shares closed Thursday at $32.20, a loss of $0.16.Starz Shares Volatile on Conflicting Reports",12/4/2014 18:21:00,"Benzinga's M&A Chatter for Thursday December 4, 2014",The Rumor:,,,,,,,,,,
Fw60,2,"Shares of Starz (NASDAQ: STRZA) were volatile Thursday, on conflicting reports from various media outlets. CNBC's David Faber reported early in the day that CBS Corporation (NYSE: CBS) had no interest in the media and entertainment company. Later, a Forbes article suggested that Lions Gate Entertainment Corp. (NYSE: LGF), Twenty-First Century Fox, Inc. (NASDAQ: FOXA) and Comcast Corporation (NYSE: CMCSA) could be potential buyers. Just before the close Thursday, Bloomberg reported that Starz was exploring options, including partnerships with U.S.-based or European-based media companies.A Starz spokesperson was not available for comment.Strarz closed Thursday at $27.76, a loss of 16%.Keurig Green Mountain Acquires Bevyz For $220 Million",12/4/2014 18:21:00,"Benzinga's M&A Chatter for Thursday December 4, 2014",The Rumor:,,,,,,,,,,
Fw60,3,"Keurig Green Mountain, Inc. (NASDAQ: GMCR) announced Thursday, that it has entered into an agreement to acquire the outstanding equity of Bevyz that it does not already own. The transaction is valued at approximately $220 million.The deal is expected to close in the next month.Keurig Green Mountain closed Thursday at $134.28, a loss of 1%.Posted-In: News Rumors M&A Movers© 2015 Benzinga.com. Benzinga does not provide investment advice. All rights reserved.",12/4/2014 18:21:00,"Benzinga's M&A Chatter for Thursday December 4, 2014",The Deal:,,,,,,,,,,
gw54,0,"The following are the M&A deals, rumors and chatter circulating on Wall Street for Wednesday December 3, 2014:UTI Worldwide in Advanced Talks for Sale to DSV",12/3/2014 20:16:00,"Benzinga's M&A Chatter for Wednesday December 3, 2014",NA,,,,,,,,,,
gw54,1,"Shares of UTi Worldwide Inc. (NASDAQ: UTIW) spiked sharply higher Wednesday, following a report by Bloomberg, that the non-asset-based supply chain management company was in advanced talks to be acquired by Denmark's DSV A/S (OTC: DSDVY). Sources say UTi has been in sale talks since the middle of this year and an agreement could be reached by end of December.AUTi spokesperson declined Comment on the rumored. A DSV spokesperson was not immediately available for comment.UTi Worldwide closed Wednesday at $13.88, a gain of 20%.Hearing Unconfirmed Report of Lotte/Samsung Stake in Target",12/3/2014 20:16:00,"Benzinga's M&A Chatter for Wednesday December 3, 2014",The Rumor:,,,,,,,,,,
gw54,2,"Shares of Target Corp. (NYSE: TGT) spiked higher Wednesday, on a report out of South Korea that Lotte Group and Samsung (OTC: SSNLF) had taken a 10% stake in the U.S, retailer and formed a joint venture to enable Target to expand in Asia. A spokesperson for Target denied comment on the rumor. A spokesperson for Lotte Group was not immediately available for comment.Target shares closed Wednesday at $73.33, a gain of $0.26.NextEra Energy and Hawaiian Electric Industries to Combine in $4.3B Deal",12/3/2014 20:16:00,"Benzinga's M&A Chatter for Wednesday December 3, 2014",The Rumor:,,,,,,,,,,
gw54,3,"NextEra Energy, Inc. (NYSE: NEE) and Hawaiian Electric Industries, Inc. (NYSE: HE) announced Wednesday that the companies have agreed to combine in a transaction valued at approximately $4.3 billion. The deal includes the assumption of $1.7 billion in HEI debt, while excluding HEI's banking subsidiary. HEI announced separately, a plan to spin off ASB Hawaii, the parent company of American Savings Bank.HEI shareholders will receive an estimated total value of approximately $33.50 per share, consisting of 0.2413 shares of NextEra Energy common stock for each HEI share they own, valued at $25.00 per HEI share, based on NextEra Energy's volume-weighted average stock price for the 20 trading days ended Dec. 2, 2014; a one-time special cash dividend, to be paid by HEI, of $0.50 per HEI share for shareholders of record as of the date immediately prior to the closing of the transaction; and Shares of ASB Hawaii, through the spinoff transaction, with a current estimated value of $8.00 per share based on consensus analyst estimates.The transaction is expected to close in within approximately 12 months.Hawaiian Electric closed Wednesday, to close at $16.92.Posted-In: News Rumors M&A Movers© 2015 Benzinga.com. Benzinga does not provide investment advice. All rights reserved.",12/3/2014 20:16:00,"Benzinga's M&A Chatter for Wednesday December 3, 2014",The Deal:,,,,,,,,,,
ky32,0,"The following are the M&A deals, rumors and chatter circulating on Wall Street for Tuesday December 2, 2014:Apollo Global Management Most Likely Buyer for PetSmart",12/2/2014 17:40:00,"Benzinga's M&A Chatter for Tuesday December 2, 2014",NA,,,,,,,,,,
